D-ID,"Turning images & videos into Creative Reality experiences",Image Recognition Artificial Intelligence,"📍HQ: Tel Aviv, Israel",51-100 ,2017,http://www.d-id.com/?utm_source=topstartups.io,https://linkedin.com/company/deidentification,"https://www.glassdoor.com/Overview/Working-at-D-ID-EI_IE3111543.11,15.htm",
Drishti,"Drishti is a provider of AI-powered video analytics technology that gives visibility and insights for manual assembly line improvement.",Analytics Artificial Intelligence Software ,"📍HQ: San Francisco Bay Area, California, USA",101-200 ,2017,http://drishti.com/?utm_source=topstartups.io,https://linkedin.com/company/drishtilabs,"https://www.glassdoor.com/Overview/Working-at-Drishti-Technologies-EI_IE2196931.11,31.htm",
Kneron,"Kneron develops an application-specific integrated circuit and software that offers artificial intelligence-based tools.", Artificial Intelligence Hardware  Software,"📍HQ: San Diego, California, USA",51-100 ,2015,http://www.kneron.com/?utm_source=topstartups.io,https://linkedin.com/company/kneron,"https://www.glassdoor.com/Overview/Working-at-Kneron-EI_IE2387836.11,17.htm",
Acalvio Technologies,"Acalvio provides Advanced Threat Defense solutions to detect, engage, and respond to malicious activity inside the perimeter.",Cybersecurity Data Science Machine Learning Artificial Intelligence,"📍HQ: San Francisco Bay Area, California, USA",51-100 ,2015,http://www.acalvio.com?utm_source=topstartups.io,https://linkedin.com/company/acalvio-technologies,"https://www.glassdoor.com/Overview/Working-at-Acalvio-EI_IE2168047.11,18.htm",
Iris Automation,"We are building revolutionary new ways for drones and unmanned systems to see and navigate the world.",Hardware Artificial Intelligence Space Drones,"📍HQ: San Francisco Bay Area, California, USA",51-100 ,2015,http://www.irisonboard.com/?utm_source=topstartups.io,https://linkedin.com/company/iris-automation,"https://www.glassdoor.com/Overview/Working-at-Iris-Automation-CA-EI_IE1908802.11,29.htm",
Abridge,"Build audio-based system to record and summarize medical conversations",Healthcare  Artificial Intelligence,"📍HQ: Pittsburgh, Pennsylvania, USA",11-50 ,2018,http://abridge.com/?utm_source=topstartups.io,https://linkedin.com/company/abridge-ai,"https://www.glassdoor.com/Overview/Working-at-Abridge-EI_IE3146134.11,18.htm",
Phiar Technologies,"Phiar's Ultra-lightweight Spatial AI Engine enables vehicles to perceive its surroundings, and powers our first use case in AR Navigation.",Autonomous Vehicles Data Science Deep Learning Artificial Intelligence,"📍HQ: San Francisco Bay Area, California, USA",11-50 ,2017,http://www.phiar.net?utm_source=topstartups.io,https://www.linkedin.com/company/phiar,"https://www.glassdoor.com/Overview/Working-at-Phiar-Technologies-EI_IE3238398.11,29.htm",
lexion.ai,"Lexion is an AI-powered contract management startup",Artificial Intelligence  Enterprise Software ,"📍HQ: Seattle, Washington, USA",11-50 ,2018,http://lexion.ai/?utm_source=topstartups.io,https://linkedin.com/company/lexion-ai,"https://www.glassdoor.com/Overview/Working-at-Lexion-EI_IE4843047.11,17.htm",
Avvir,"Avvir uses laser scans and AI to catch construction mistakes, and monitor construction progress.",Construction  Artificial Intelligence,"📍HQ: New York, New York, USA",11-50 ,2017,http://avvir.io/?utm_source=topstartups.io,https://linkedin.com/company/avvir,"https://www.glassdoor.com/Overview/Working-at-Aviir-EI_IE821857.11,16.htm",
AI2,"AI2 is an artificial intelligence research institute and start-up incubator.",Artificial Intelligence  Research  Startup Incubator,"📍HQ: Seattle, Washington, USA",201-500 ,2015,https://allenai.org/?utm_source=topstartups.io,https://www.linkedin.com/company/allen-ai/,"https://www.glassdoor.com/Reviews/Employee-Review-Allen-Institute-for-AI-RVW4699774.htm",
Pixie,"We build machine intelligence systems which empower developers to engineer the future.",Artificial Intelligence  Developer Tools  Enterprise Software,"📍HQ: San Francisco Bay Area, California, USA",11-50 ,2018,http://pixielabs.ai/?utm_source=topstartups.io,https://linkedin.com/company/pixieai,"https://www.glassdoor.com/Overview/Working-at-Pixie-Services-EI_IE1598655.11,25.htm",
CrowdAI,"CrowdAI empowers organizations to create and deploy custom models for visual AI, in a simple, code-free platform.",Image Recognition Data Science Hardware Artificial Intelligence Drones,"📍HQ: San Francisco Bay Area, California, USA",11-50 ,2016,http://crowdai.com/?utm_source=topstartups.io,https://linkedin.com/company/18144927,"https://www.glassdoor.com/Overview/Working-at-CrowdAI-EI_IE4292779.11,18.htm",
Vahan,"We use Artificial Intelligence to bring job services inside WhatsApp",  Messaging Recruiting Artificial Intelligence,"📍HQ: Bangalore, India",51-100 ,2016,http://vahan.ai?utm_source=topstartups.io,https://in.linkedin.com/company/vahan-inc-,"https://www.glassdoor.com/Overview/Working-at-Vahan-EI_IE1493574.11,16.htm",
Catalia Health,"We create the Mabu personal healthcare companion to help patients with chronic disease and collect data to healthcare providers.",Artificial Intelligence  Healthcare  Robotics  Hardware,"📍HQ: San Francisco Bay Area, California, USA",11-50 ,2014,http://cataliahealth.com?utm_source=topstartups.io,https://linkedin.com/company/catalia-health,"https://www.glassdoor.com/Overview/Working-at-Catalia-Health-EI_IE3172395.11,25.htm",
Docbot,"Docbot, Inc. is an artificial intelligence technology company focusing on gastrointestinal (GI) disease.",Healthcare Artificial Intelligence  Biotech,"📍HQ: Los Angeles, California, USA",11-50 ,2014,http://docbot.ai/?utm_source=topstartups.io,https://linkedin.com/company/docbot-ai,"https://www.glassdoor.com/Job/irvine-artificial-intelligence-jobs-SRCH_IL.0,6_IC1146798_KO7,30.htm",
Sourceress,"Sourceress is an AI recruiter that is reinventing how people find jobs.",Recruiting Artificial Intelligence,"📍HQ: San Francisco Bay Area, California, USA",1-10 ,2016,https://www.sourceress.com/?utm_source=topstartups.io,https://linkedin.com/company/sourceress,"https://www.glassdoor.com/Overview/Working-at-Sourceress-EI_IE1872135.11,21.htm",
Intelecy,"Norwegian tech company using machine learning to prevent breakdowns, predict failures, improve production processes",Machine Learning Artificial Intelligence Predictive Analytics,"📍HQ: Oslo, Norway",11-50 ,2016,http://www.intelecy.com?utm_source=topstartups.io,https://linkedin.com/company/15247471,"https://www.glassdoor.com/Overview/Working-at-Intelect-Belgium-EI_IE2022523.11,27.htm",
Playment,"We are fully-managed solution offering training data for computer vision, machine learning and human-in-the-loop for AI at scale.",Data Science Artificial Intelligence Autonomous Vehicles,"📍HQ: Bangalore, India",101-200 ,2015,http://playment.io/?utm_source=topstartups.io,https://linkedin.com/company/playment,"https://www.glassdoor.com/Overview/Working-at-Playment-EI_IE1385135.11,19.htm",
Mihup,"Intelligence-based personal mobile assistant app",Artificial Intelligence  Speech Recognition,"📍HQ: Kolkata, India",51-100 ,2016,http://www.mihup.com?utm_source=topstartups.io,https://linkedin.com/company/mihup,"https://www.glassdoor.com/Overview/Working-at-Mihup-Communications-EI_IE2079900.11,31.htm",
HiOperator,"HiOperstor provides customer support as-a-service.",Artificial Intelligence Customer Support,"📍HQ: San Francisco Bay Area, California, USA",51-100 ,2016,http://hioperator.com?utm_source=topstartups.io,https://linkedin.com/company/10698236,"https://www.glassdoor.com/Reviews/HiOperator-Reviews-E2096252.htm",
Cureskin,"Cureskin is an AI powered application that provides derma care through mobile devices.",Skin Care  Artificial Intelligence,"📍HQ: Bengaluru, India",11-50 ,2016,http://cureskin.com/?utm_source=topstartups.io,https://linkedin.com/company/heallo.ai,"https://www.glassdoor.com/Overview/Working-at-Cureskin-EI_IE4187713.11,19.htm",
DeepL,"DeepL is a leading deep learning company for language translation",Artificial Intelligence Translation ML,"📍HQ: Cologne, Germany",101-200 ,2009,http://www.linguee.com?utm_source=topstartups.io,https://www.linkedin.com/company/linkedin-com-company-deepl/,"https://www.glassdoor.com/Reviews/Employee-Review-Google-RVW20235921.htm",
